{
  "schema_version": 1,
  "target_profile": "sha1-fips180-4-v1",
  "attack_class": "ordinary-collision",
  "rounds": 80,
  "claim": {
    "time_log2": 92.0,
    "time_unit": "sha1-compressions",
    "memory_log2_bytes": 87.0,
    "data_log2": 80.0,
    "preprocessing_log2": 0.0,
    "success_probability": 0.39,
    "nonuniform_advice_log2_bytes": 0.0
  },
  "restrictions": [
    "Uses the random-function heuristic for SHA-1 outputs on distinct sampled messages.",
    "Uses two packed 32-byte-per-record radix-sort buffers.",
    "Uses the organizer's abstract 128-bit word-RAM and charges every non-hash primitive operation as one SHA-1-compression-equivalent time unit."
  ],
  "baseline_improved": "none-organizer-baseline",
  "certificate_manifest": "certificates/manifest.json"
}
